tenet,2020,false,Action,7.3,Time inversion,Nolan,363
the dark knight,2008,false,Action,9.0,Batman battles the Joker,Nolan,1005
interstellar,2014,false,Action,8.7,A team travels through a wormhole,Nolan,677
the room,2003,false,Action,3.7,A disastrous romance spirals wildly,Wiseau,2
the matrix,1999,true,Action,8.7,a hacker discovers reality,the wachowskis,463517383
the matrix,1999,true,Action,8.7,a hacker discovers reality,the wachowskis,463517383
the matrix ii,1999,true,Action,8.7,a hacker discovers reality,the wachowskis,463517383
